{
  "cycle_id": "2026-07-21-mvrv-sth-resistance-01",
  "status": "published",
  "published_at": "2026-07-21T23:30:11+00:00",
  "channel": "manual",
  "post_url": "https://x.com/VantageNodvt/status/2079675418945163580",
  "post_id": "2079675418945163580",
  "approval_ref": "cycles/2026-07-21-mvrv-sth-resistance-01/APPROVAL.md"
}
