{
  "cycle_id": "2026-07-23-nupl-bear-easing-01",
  "status": "published",
  "published_at": "2026-07-24T00:04:52+00:00",
  "channel": "manual",
  "post_url": "https://x.com/VantageNodvt/status/2080443472545300739",
  "post_id": "2080443472545300739",
  "reply_id": "2080443695589925142",
  "approval_ref": "cycles/2026-07-23-nupl-bear-easing-01/APPROVAL.md"
}
