{
  "cycle_id": "2026-07-22-sth-cost-convergence-01",
  "status": "published",
  "published_at": "2026-07-22T14:18:00+00:00",
  "channel": "manual",
  "post_url": "https://x.com/VantageNodvt/status/2079934104686997634",
  "post_id": "2079934104686997634",
  "reply_id": "2079934826962997539",
  "approval_ref": "cycles/2026-07-22-sth-cost-convergence-01/APPROVAL.md"
}
