{
  "cycle_id": "2026-07-16-mvrv-01",
  "status": "published",
  "published_at": "2026-07-18T00:27:14+00:00",
  "channel": "manual",
  "post_url": "https://x.com/VantageNodvt/status/2078274466266612210",
  "post_id": "2078274466266612210",
  "reply_id": "2078274799407599927",
  "approval_ref": "cycles/2026-07-16-mvrv-01/APPROVAL.md"
}
