{
  "cycle_id": "2026-07-20-mvrv-cohort-01",
  "status": "published",
  "published_at": "2026-07-21T01:43:12+00:00",
  "channel": "manual",
  "post_url": "https://x.com/VantageNodvt/status/2079379527604601035",
  "post_id": "2079379527604601035",
  "reply_id": "2079379958267277797",
  "approval_ref": "cycles/2026-07-20-mvrv-cohort-01/APPROVAL.md"
}
