{
  "cycle_id": "2026-07-18-sopr-lth-01",
  "status": "published",
  "published_at": "2026-07-18T20:32:04+00:00",
  "channel": "manual",
  "post_url": "https://x.com/VantageNodvt/status/2078577777293275536",
  "post_id": "2078577777293275536",
  "reply_id": "2078578158362599440",
  "approval_ref": "cycles/2026-07-18-sopr-lth-01/APPROVAL.md"
}
